{
      "1" : {
        "Company": "TravelBlender",
        "Sector": "Travel and Tourism",
        "Location": "Ladakh",
        "Funding": "1,00,00,000",
        "Stage": "Pre-Seed",
        "Founder": "Genevieve Catalano",
        "Pitch": "Hello, I'm Genevieve Catalano, the proud owner of TravelBlender, a revolutionary platform that crafts a seamless blend of travel partners and custom itineraries. TravelBlender operates in the dynamic travel and tourism sector, currently valued at $1.5 trillion, and is poised to transform the way people plan and experience their journeys. Over the past year, TravelBlender has achieved a remarkable 300% increase in user engagement, establishing itself as a key player in the personalized travel planning space. Market trends underscore the vast potential for growth in our sector. The global demand for personalized travel experiences has surged, with a projected 20% annual increase. Our data analytics reveal a 40% month-over-month increase in user satisfaction, emphasizing the strong and growing demand for TravelBlender's unique offerings. To capitalize on this momentum and expand our footprint, we are seeking inr 1,00,00,000 in investment. These funds will be utilized to enhance our technology platform, onboard new travel partners, and launch strategic marketing initiatives. This investment opportunity is particularly attractive in Ladakh, a travel-centric region known for its diverse and adventurous demographic. TravelBlender isn't just a travel platform; it's a curated journey tailored to individual preferences. Your investment in TravelBlender is an invitation to be part of a dynamic venture that's reshaping the travel industry. Thank you for considering this exciting investment opportunity."
      },
      "2" : {
        "Company": "Party on Demand",
        "Sector":"Entertainment",
        "Location":"Delhi",
        "Funding":"80,00,000",
        "Stage":"Pre-Seed",
        "Founder": "Willy Green",
        "Pitch": "Hello, I'm Willy Green, the enthusiastic owner of Party on Demand, an innovative solution in the event planning and entertainment sector. Party on Demand operates in a market valued at $30 billion and experiencing significant growth. In the past year, we've achieved a stellar 250% increase in revenue, positioning ourselves as a leader in providing hassle-free, on-demand event experiences. Market trends underscore the vast potential for growth in our sector. The global demand for personalized and convenient event services is on the rise, with a projected 15% annual increase. Our data analytics reveal a 20% month-over-month increase in user engagement, showcasing the strong and growing demand for Party on Demand's unique offerings. To capitalize on this momentum and expand our market presence, we are seeking inr 80,00,000 in investment. These funds will be utilized to enhance our technology platform, broaden our service offerings, and establish a flagship location in Delhi, a thriving event-centric city where Party on Demand is primed for success. Party on Demand isn't just an event planning service; it's a revolutionary approach to creating memorable experiences on demand. Your investment in Party on Demand is an invitation to be part of a dynamic venture that's redefining the event planning landscape. Thank you for considering this exciting investment opportunity."
      }
}
  